Text;Date;LikesCount;RepostCount;URLs
Каковы правила получения комплексных экологических разрешений? Как составить программу повышения экологической эффективности предприятия? Как подготовить отчетность при изменении категории объекта НВОС? Узнайте ответы на эти и другие вопросы, зарегистрировавшись для участия в цикле вебинаров «НПА, регламентирующие технологическое нормирование: новые требования»!  http://promo.paradigma.center/cycle/?utm_source=vkontakte_ep&utm_medium=social&utm_campaign=1_cycle;27 06 2019 8:06:55;35;5;https://pp.userapi.com/c858128/v858128331/14b6/12ZyXitBf9o.jpg
"Коллеги, читайте в следующем выпуске журнала ""Экология производства""   ПРАВОПРИМЕНИТЕЛЬНАЯ ПРАКТИКА  Применение технологических показателей НДТ для расчета технологических нормативов в заявке на получение комплексного экологического разрешения  После рассмотрения в предыдущем номере требований, установленных в отношении технологических показателей, обратим внимание на их применение для расчета технологических нормативов в заявке на получение комплексного экологического разрешения.  ОБРАЩЕНИЕ С ОТХОДАМИ  Требования к откачке содержимого выгребных ям  Что происходит при очистке выгребных ям – «откачка сточных вод» или «прием жидких бытовых отходов»? Каковы условия перехода права собственности на жидкие бытовые отходы в цепочке «заказчик – транспортировщик»? Что необходимо предпринять для лицензирования деятельности приемщиков жидких бытовых отходов? И каковы особенности передачи жидких бытовых отходов на очистку организациям ВКХ?  Как провести инвентаризацию отходов производства и потребления  Для составления программы производственного экологического контроля необходимы сведения об образующихся на предприятии отходах.  Требования к обустройству мест временного накопления отходов  Федеральным законом от 17.06.2019 № 141-ФЗ «О внесении изменений в Кодекс Российской Федерации об административных правонарушениях» устанавливается, что несоблюдение санитарно-эпидемиологических требований к сбору, накоплению, транспортированию, обработке, утилизации или обезвреживанию отходов производства и потребления влечет наложение значительного административного штрафа или административное приостановление деятельности в зависимости от определенных условий. Следовательно, предприятиям важно выполнять требования экологического законодательства, предъявляемые к накоплению отходов и к местам временного их размещения.  Технический отчет по обращению с отходами в 2019 году  В связи с многочисленными вопросами на данную тему предлагаются анализ действующих нормативно-правовых актов и позиций уполномоченных органов по данной теме, а также определенный алгоритм действий в зависимости от категории, присвоенной объекту негативного воздействия.  ОЦЕНКА ВОЗДЕЙСТВИЯ НА ОКРУЖАЮЩУЮ СРЕДУ  Инженерно-экологические изыскания: современная практика  Результаты инженерно-экологических изысканий показывают возможность реализации проектных решений на выбранной территории с точки зрения соблюдения природоохранных и санитарных норм.  ВОДОПОЛЬЗОВАНИЕ  Учет воды на предприятии  Основная цель учета водопотребления и водоотведения на предприятии – получение достоверной информации о том, сколько воды изъято из водных объектов и сколько воды возвращено в природную среду. На основе этих данных формируется различного рода отчетность, а также рассчитываются платежи за негативное воздействие на окружающую среду (НВОС) и водный налог.  ОХРАНА ВОДНЫХ РЕСУРСОВ  Последствия присвоения водному объекту рыбохозяйственной категории и перспективы ее изменения  Постановлением Правительства РФ от 28.02.2019 № 2061 утвержден порядок отнесения водного объекта к объектам рыбохозяйственного значения с определением его рыбохозяйственной категории.  ПРОГРАММНОЕ ОБЕСПЕЧЕНИЕ ДЛЯ ЭКОЛОГОВ  Работа в «Модуле природопользователя»: некоторые тонкости и советы  Каждый природопользователь, помимо разработки основной природоохранной документации, обязан ежегодно сдавать большое количество отчетов, расчетов и деклараций. Программное средство «Модуль природопользователя» позволяет подготавливать такую отчетность бесплатно.  ОТВЕТ СПЕЦИАЛИСТА  Информационно-технический справочник по производственному экологическому контролю  Сброс на рельеф  Лимиты на размещение отходов для объектов II категории  Как скорректировать плату с учетом затрат на реализацию природоохранных мероприятий  Зачет или возврат переплаты: за кем решающее слово?  http://promo.ecoindustry.ru";03 07 2019 12:56:05;25;8;https://sun3-1.userapi.com/c854416/v854416361/846fb/Nqyesw6RkwQ.jpg
"Коллеги, вышел июльский номер журнала ""Экология производства""  Напоминаем, что с мая 2019 года расширен функционал электронной версии журнала ""Экология производства""   Все документы доступны для просмотра и скачивания по прямой ссылке!!!  http://mag.ecoindustry.ru/Журнал-Экология-производства-7-за-2019-г/0165935001561992454";03 07 2019 12:02:59;9;2;
"Разработан административный регламент по выдаче КЭР   Росприроднадзором разработан проект Административного регламента выдачи комплексных экологических разрешений (далее соответственно - Проект регламента, КЭР).    Проектом регламента планируется, что выдачу КЭР будут осуществлять территориальные органы Росприроднадзора по месту расположения объекта негативного воздействия на окружающую среду (далее - НВОС).    Предполагается, что в рамках предоставления услуги по выдаче КЭР осуществляются также процедуры (п.59 Проекта регламента):  - выдачи КЭР;  - продления КЭР;  - переоформления КЭР;  - пересмотра КЭР;  - внесения в КЭР изменений;   - исправления технических ошибок (опечаток);  - выдачи дубликата КЭР;  - отзыва КЭР.    Для осуществления вышеперечисленных процедур Проектом регламента планируется установить:  - сроки выдачи, переоформления, пересмотра, продления КЭР, а также сроки внесения изменений в КЭР (п.п.13-17 Проекта регламента);  - полный перечень документов, необходимых для предоставления услуги по выдаче КЭР (п.п.19-27 Проекта регламента);  - порядок осуществления той или иной процедуры, выполняемой в рамках выдачи КЭР (разд.III Проекта регламента).    Проектом регламента предлагаются к утверждению формы:  - заявки на переоформление КЭР;  - заявления об исправлении технических ошибок (опечаток);  - заявления о выдаче дубликата КЭР.    Обращаем внимание, что Проектом регламента планируется установить порядок досудебного обжалования решений и действий (бездействия) территориальных органов Росприроднадзора, осуществляющих выдачу КЭР.    До момента утверждения Проекта регламента выдача КЭР осуществляется в соответствии с Правилами выдачи комплексных экологических разрешений, их переоформления, пересмотра, внесения в них изменений, а также отзыва, утвержденными постановлением Правительства РФ от 13.02.2019 г. N 143.    Рекомендуем ознакомиться с текстом Проекта регламента хозяйствующим субъектам, осуществляющим деятельность на объектах:  - I категории НВОС;  - II категории НВОС и относящихся к области применения наилучших доступных технологий, если данные лица планируют получать КЭР.   Своевременно узнать о готовящихся изменениях законодательства о разработке и получении КЭР вы сможете на наших вебинарах.  http://promo.paradigma.center/cycle/";03 07 2019 11:08:05;41;17;https://sun3-4.userapi.com/c850228/v850228035/186365/y-HBE71QrG0.jpg
